{"$schema":"https://json-schema.org/draft/2020-12/schema","$id":"https://altru.dev/calibration/schemas/calibration-continuous-plan-0.8.schema.json","title":"Calibration Studio continuous plan 0.8","type":"object","required":["schema","evaluate"],"properties":{"schema":{"const":"calibration-continuous-plan/0.8"},"current_ref":{"type":"string","minLength":1},"trace_on_regression":{"type":"boolean"},"gate":{"type":"object","properties":{"fail_on_environment_change":{"type":"boolean"},"fail_on_untracked_observations":{"type":"boolean"}},"additionalProperties":false},"trace":{"type":"object","properties":{"strategy":{"enum":["exact","binary"]},"max_commits":{"type":"integer","minimum":2,"maximum":5000},"good_ref":{"type":["string","null"]}},"additionalProperties":false},"setup_commands":{"type":"array","maxItems":32,"items":{"$ref":"#/$defs/command"}},"evaluate":{"$ref":"#/$defs/command"},"pass_environment":{"type":"array","items":{"type":"string","pattern":"^[A-Za-z_][A-Za-z0-9_]*$"}},"environment":{"type":"object","additionalProperties":{"type":"string"}}},"additionalProperties":false,"$defs":{"command":{"type":"object","required":["command"],"properties":{"command":{"type":"string","minLength":1},"args":{"type":"array","items":{"type":"string"}},"cwd":{"type":"string"},"timeout_ms":{"type":"number","minimum":100,"maximum":3600000}},"additionalProperties":false}}}
